{"specification_id":"MWM-EQA-SPEC","run_id":"EQA-RUN-EXAMPLE-001","stage":"editorial_review","status":"ready_with_tracked_items","skills_run":["CE","TE"],"skills_deferred":["RCI"],"preconditions":[{"id":"envelope","status":"pass","evidence":"EQA-RUN-EXAMPLE-001"}],"findings":[],"open_blocks":[],"disagreements":[],"human_decisions_required":[],"coverage_statement":"CE/TE checked configured scope; RCI deferred; no substantive truth or accessibility conformance established.","residual_risk":"moderate","next_actions":["Run RCI when citation bundle is available."],"receipt_id":"EQA-REC-EXAMPLE-001","ledger":{"ledger_id":"EQA-LEDGER-EXAMPLE-001","run_id":"EQA-RUN-EXAMPLE-001","node_ids":["EQA-NODE-CE-001"],"completed_node_ids":["EQA-NODE-CE-001"],"deferred_node_ids":["EQA-NODE-RCI-001"],"blocked_node_ids":[],"stale_node_ids":[],"finding_ids":[],"disagreement_ids":[],"decision_ids":[],"receipt_ids":["EQA-REC-EXAMPLE-001"],"open_blocks":[],"human_decisions_required":[],"coverage_statement":"Configured scope checked.","residual_risk":"moderate","release_decision":"ready_with_tracked_items","created_at":"2026-08-14T00:00:00Z","supersedes":null},"generated_at":"2026-08-14T00:00:00Z"}
